{
  "$schema": "https://json-schema.org/draft/2020-12/schema",
  "$id": "https://github.com/oso-gato/dev-pair/shared/contracts/refresh-manifest.v1.schema.json",
  "title": "refresh-manifest v1",
  "description": "Arms one component refresh after a merge. A merge is not a deployment: this manifest is what the repo and image watchers emit, what the outside-in refresh consumes, and what the live gate (G2) verifies by read-back.",
  "type": "object",
  "additionalProperties": false,
  "required": ["grammar", "v", "merge-sha", "target", "rollback", "session-policy", "verify", "armed-by", "armed-at"],
  "properties": {
    "grammar": { "const": "refresh-manifest" },
    "v": { "const": 1 },
    "merge-sha": {
      "type": "string",
      "pattern": "^[0-9a-f]{40}$",
      "description": "The merged commit being deployed. The live gate reads the target back against this sha, fail-closed."
    },
    "target": {
      "enum": ["host", "dev-container"],
      "description": "Exactly one component per manifest; the stagger is one manifest per side, refreshed from outside."
    },
    "image": {
      "type": "string",
      "minLength": 1,
      "description": "The merged image reference. Required when target is dev-container."
    },
    "rollback": {
      "type": "object",
      "additionalProperties": false,
      "required": ["kind", "ref"],
      "properties": {
        "kind": {
          "enum": ["image", "converger"],
          "description": "image: roll back to this image. converger: re-converge from this repository version."
        },
        "ref": { "type": "string", "minLength": 1 }
      },
      "description": "The previous known-good state. Every autonomous mutation is reversible (P10); a manifest without a rollback is refused."
    },
    "session-policy": {
      "enum": ["resume", "defer"],
      "description": "resume: capture the session set, refresh, restore every session to active work, verified (the standing rule). defer: live sessions block until they quit (the fallback for unproven resume classes, never the steady state)."
    },
    "verify": {
      "type": "array",
      "minItems": 1,
      "items": {
        "type": "object",
        "additionalProperties": false,
        "required": ["kind", "ref", "expect"],
        "properties": {
          "kind": {
            "enum": ["file-sha", "command", "service-state"],
            "description": "file-sha: a deployed file's digest. command: a read-back command's output. service-state: a unit/container's live state."
          },
          "ref": { "type": "string", "minLength": 1 },
          "expect": {
            "type": "string",
            "minLength": 1,
            "description": "The exact expected value the live gate compares against."
          }
        }
      },
      "description": "The read-back checks G2 runs on the live target. Not done until every check passes."
    },
    "armed-by": {
      "type": "string",
      "minLength": 1,
      "description": "The watcher that armed the refresh (repo clock or image clock)."
    },
    "armed-at": { "type": "string", "format": "date-time" }
  },
  "allOf": [
    {
      "if": { "properties": { "target": { "const": "dev-container" } } },
      "then": { "required": ["image"] }
    }
  ]
}
